Title of Paper,Year,Application Type,Application Course,Application Department,Application Class,Guid 1 Name,Guid 2 Name,Type of Paper,Type of Publication,Conference_Type
Accelerating Circuit Simulation using Graphics Processing Unit,2016-17,Student,UG,COMPS,F.Y.,Dr. Y.S. Rao,nan,Conference,International,IEEE
An Automated Antenna Pattern Measurement System,2016-17,Student,UG,COMPS,F.Y.,Prof. Manisha Bansode,Dr. Surendra S. Rathod,Conference,International,IEEE
Comparative Study on Attribute-Based Encryption for Health Records in Cloud Storage,2016-17,Student,PG,COMPS,Student,Dr. Sudhir Namdeorao Dhage,Dr. Anant V. Nimkar,Conference,International,IEEE
Composite Secured MQTT for Internet of Things using ABE and Dynamic S-BOX AES,2016-17,Student,UG,COMPS,F.Y.,Prof. Manish M. Parmar,nan,Conference,International,IEEE
"Design and Performance Enhancement of Circularly Polarised Antenna,IEEE Indian Antenna Week",2016-17,Student,UG,COMPS,F.Y.,Dr. Reena Sonkusare,nan,Conference,International,IEEE
Machine Learning Approach for Detecting Malicious Domain Names,2016-17,Student,PG,COMPS,B.E.,Prof. Nataasha Raul,nan,Conference,International,IEEE
Malicious Web Content Detection Using Machine Learning,2016-17,Student,UG,COMPS,S.Y.MTech,Prof. Nataasha Raul,nan,Conference,International,IEEE
MULTIBAND MIMO ANTENNA WITH REDUCED MUTUAL COUPLING,2016-17,Student,UG,COMPS,F.Y.,Prof. Anand D. Mane,nan,Journal,International,IEEE
Realization of Virtual Resource Management Framework in IaaS Cloud Federation,2016-17,Student,PG,COMPS,S.Y.MTech,Dr. Anant V. Nimkar,nan,Conference,International,IEEE
Real-time performance evaluation and stability testing of RasPBX for VoWiFi,2016-17,Student,UG,COMPS,F.Y.,Prof. Dayanand Ambawade,nan,Conference,International,IEEE
Rush Balancing in Public Transport using FLIR Camera and Internet of Things,2016-17,Student,PG,COMPS,T.Y.MCA,Prof. Rupesh Bhoir,Mr. Sarvesh Bedekar,Conference,National,IEEE
A Comparative Study on RPL Attacks and Security Solutions.,2016-17,Student,PG,COMPS,Faculty,Dr. Sudhir Namdeorao Dhage,Dr. Anant V. Nimkar,Conference,International,IEEE
A Miniaturized and Improved Antenna Using Metamaterial,2016-17,Student,PG,COMPS,Faculty,Dr. Sudhir Namdeorao Dhage,nan,Conference,International,IEEE
A subgraph mining algorithm on big data,2016-17,Faculty,PG,COMPS,Faculty,Prof. Jyoti Ramteke,nan,Conference,International,IEEE
Adaptive e-learning system using hybrid approach,2016-17,Student,PG,COMPS,Faculty,Prof. Anand Godbole,nan,Conference,International,IEEE
Artificial Intelligence enabled Machine Learning approach for recognizing early stage of Psoriasis and Eczema,2016-17,Student,UG,COMPS,Faculty,Dr. D. R. Kalbande,Dr.Mithali Jage,Conference,International,IEEE
CARPOOLING : Innovative way to resolve traffic congestion,2016-17,Student,PG,COMPS,Faculty,Prof. Kiran Gawande,nan,Conference,International,IEEE
Election Result Prediction using twitter sentiment analysis,2016-17,Student,UG,COMPS,Faculty,Prof. Jyoti Ramteke,nan,Conference,International,IEEE
Implementation of Career Guidance System in Undergraduate Study for Smooth Transition to Future Prospects,2016-17,Faculty,PhD,COMPS,Faculty,Dr. Prachi Gharpure,nan,Conference,International,IEEE
IOT Based Information Dissemination System in the field of Education,2016-17,Faculty,UG,COMPS,Faculty,Prof. Reeta Koshy,nan,Conference,International,IEEE
Machine Vision Based Approach to analyze Street Surface Anomalies,2016-17,Student,PG,COMPS,Faculty,Prof. Surekha Dholay,nan,Conference,International,IEEE
Measuring the Effectiveness of Collaborative Learning through Technical Competitions,2016-17,Faculty,UG,COMPS,Faculty,Dr. Surendra S. Rathod,Dr. Prachi Gharpure,Conference,International,IEEE
Optimal Query Processing on Geo-spatial Objects,2016-17,Student,UG,COMPS,Faculty,Dr. Sudhir Namdeorao Dhage,Dr. Anant V. Nimkar,Conference,International,IEEE
Role of SMAC Technologies in Diabetes Management using ITS,2016-17,Faculty,PhD,COMPS,Faculty,Dr. Pooja Raundale,nan,Conference,International,IEEE
selection of optimal services working in SCM strategies using fuzzy decision making methods,2016-17,Faculty,PhD,COMPS,Faculty,Dr. D. R. Kalbande,nan,Conference,International,IEEE
A Hybrid Deep Learning Architecture for Paraphrase Identification,2017-18,Student,PG,COMPS,F.Y.,Dr. Anant V. Nimkar,nan,Conference,International,IEEE
A Meticulous Critique on Prevailing Techniques of Aspect-Level Sentiment Analysis,2017-18,Student,PG,COMPS,F.Y.,Dr. Sudhir Namdeorao Dhage,nan,Conference,International,IEEE
A robust and Verifiable threshold multiauthority access control system in public cloud storage :a survey,2017-18,Student,PG,COMPS,F.Y.,Prof. Jyoti Ramteke,nan,Conference,International,IEEE
A Sixth Sense door using Internet of Things,2017-18,Student,UG,COMPS,F.Y.,Prof. Jyoti Ramteke,nan,Conference,International,IEEE
Affinity Analysis for context free grammars,2017-18,Student,UG,COMPS,F.Y.,Dr. Prachi Gharpure,Prof. Anand Godbole,Conference,International,IEEE
Agile Parameter Affecting Supply Chain Management Strategy,2017-18,Faculty,PhD,COMPS,Faculty,Dr. D. R. Kalbande,nan,Journal,International,Other
An Image Processing Approach for Analysing Assessment of Pavement Distress,2017-18,Student,PG,COMPS,F.Y.,Prof. Surekha Dholay,nan,Conference,International,IEEE
"Analysis of Programs for GPGPU Architectures"", International Conference on Trends in Electronics and Informatics (ICOEI 2018), SCADCOE",2017-18,Student,UG,COMPS,F.Y.,Dr. Y.S. Rao,nan,Conference,International,IEEE
Analysis of Technological Advances in Autism,2017-18,Student,UG,COMPS,F.Y.,Dr. D. R. Kalbande,nan,Conference,International,IEEE
Application of Associative Network theory to Mine Relevant Aspect Terms from Customer Reviews,2017-18,Student,PG,COMPS,F.Y.,Dr. D. R. Kalbande,nan,Conference,International,IEEE
Blockchain based remittances and mining using CUDA,2017-18,Student,UG,COMPS,B.E.,Prof. Jignesh Sisodia,nan,Conference,International,IEEE
Change Management Approach for Integrating IoT Technology in Healthcare system,2017-18,Student,PhD,COMPS,PhD,Dr. D. R. Kalbande,nan,Conference,International,IEEE
Click Through Rate Prediction Model for commercial promoted contents,2017-18,Student,UG,COMPS,F.Y.,Prof. Nataasha Raul,nan,Journal,International,IEEE
Common Data Model for Health Care Data,2017-18,Student,UG,COMPS,F.Y.,Prof. Reeta Koshy,nan,Conference,International,IEEE
Comparative analysis of methods for monitoring activities of daily living for the elderly people,2017-18,Student,UG,COMPS,F.Y.,Dr. D. R. Kalbande,nan,Conference,International,IEEE
Dengue Outbreak Prediction using Data Mining Techniques,2017-18,Student,PhD,COMPS,PhD,Dr. D. R. Kalbande,nan,Conference,International,IEEE
Design of Intelligent system for Autism,2017-18,Student,UG,COMPS,F.Y.,Dr. D. R. Kalbande,nan,Conference,International,IEEE
Detection of Breast Cancer from Mammograms using a Hybrid Approach of Deep Learining and Linear Classification,2017-18,Student,UG,COMPS,F.Y.,Dr. D. R. Kalbande,nan,Conference,International,IEEE
Diabetes Disease Prediction using Machine Learning on Big Data of Healthcare,2017-18,Student,PG,COMPS,F.Y.,Dr. Sudhir Namdeorao Dhage,nan,Conference,International,IEEE
Ensemble model for Twitter sentiment analysis,2017-18,Student,PG,COMPS,F.Y.,Prof. Jyoti Ramteke,nan,Conference,International,IEEE
Fire contour approximation algorithm for bord-and-pillar coal mine: Revisited,2017-18,Faculty,UG,COMPS,Faculty,Prof. Abhijeet Salunke,nan,Conference,International,IEEE
Gesture and Voice Recognition in story Telling Application,2017-18,Student,UG,COMPS,F.Y.,Dr. D. R. Kalbande,nan,Conference,International,IEEE
Harmonic Oscillator: A Classical fundamental building block for Modern Electric Power Control,2017-18,Student,UG,COMPS,F.Y.,Dr. Y.S. Rao,Dr. Rajendra R Sawant,Conference,International,IEEE
Keystrokes Dynamic Support for Authentication,2017-18,Student,PG,COMPS,F.Y.,Prof. Nataasha Raul,nan,Conference,International,IEEE
MAC based Group Management Protocol for IoT[MACGMP-IoT ],2017-18,Student,PhD,COMPS,PhD,Dr. D. R. Kalbande,nan,Conference,International,IEEE
Man-in-the-middle attack in HTTP/2,2017-18,Student,UG,COMPS,F.Y.,Dr. Anant V. Nimkar,nan,Conference,International,IEEE
Real Estate Value Prediction Using Linear Regression,2017-18,Student,PG,COMPS,F.Y.,Dr. Sudhir Namdeorao Dhage,nan,Conference,International,IEEE
Recognition of unvoiced human utterances using brain-computer interface,2017-18,Student,PhD,COMPS,F.Y.,Dr. Sudhir Namdeorao Dhage,nan,Conference,International,IEEE
Review on Machine Learning Algorithms in Reference to User Authentication,2017-18,Student,PhD,COMPS,PhD,Dr. Radha Shankarmani,nan,Conference,International,IEEE
Secure Cloud-based Federation for EHR using Multi-Authority ABE,2017-18,Student,PG,COMPS,F.Y.,Dr. Anant V. Nimkar,nan,Conference,International,IEEE
Security Schemes for Constrained Application Protocol in IoT: A Precise Survey,2017-18,Student,PG,COMPS,F.Y.,Dr. Anant V. Nimkar,nan,Conference,International,IEEE
Sign Language Recognition Using Deep Learning on Custom Processed Static Gesture Images,2017-18,Student,UG,COMPS,F.Y.,Dr. D. R. Kalbande,nan,Conference,International,IEEE
Smart Farming System : Crop Yield Prediction Using Regression Techniques,2017-18,Student,UG,COMPS,F.Y.,Dr. D. R. Kalbande,nan,Conference,International,IEEE
Smart Shopping using Beacons,2017-18,Student,UG,COMPS,F.Y.,Prof. Reeta Koshy,nan,Journal,International,IEEE
Smart-Lock Security Re-engineered using Cryptography and Steganography.,2017-18,Student,UG,COMPS,F.Y.,Dr. Anant V. Nimkar,nan,Conference,International,IEEE
Algorithm for using NLP with extremely small text datasets,2018-19,Student,UG,COMPS,B.E.,Prof. Reeta Koshy,nan,Conference,International,IEEE
Krisha: An Interactive Mobile Application for Autism Children,2018-19,Student,UG,COMPS,B.E.,Prof. Nataasha Raul,nan,Conference,International,Springer
Virtual Reality: A Possible Technology to Subdue Disorder and Disability,2018-19,Student,UG,COMPS,F.Y.,Prof. Jignesh Sisodia,nan,Conference,International,IEEE
Performance Evaluation of an Adaptive MIMO-OFDM System Model for Wireless Networks,2018-19,Student,UG,COMPS,F.Y.,Dr. Preetida Vinayakray Jani,nan,Journal,International,IEEE
A detailed study and analysis on different machine learning solutions available in the field of face tracking,2018-19,Student,UG,COMPS,B.E.,Dr. Sudhir Namdeorao Dhage,nan,Conference,International,IEEE
A Hybrid Deep Learning Architecture for Paraphrase Identification,2018-19,Student,PG,COMPS,F.Y.,Dr. Anant V. Nimkar,nan,Conference,International,IEEE
A Methodical Overview on Phishing Detection Along With An Organized Way to Construct An Anti-phishing Framework,2018-19,Student,UG,COMPS,B.E.,Dr. Sudhir Namdeorao Dhage,nan,Conference,International,IEEE
A Sixth Sense Door using Internet of Things,2018-19,Student,UG,COMPS,B.E.,Prof. Jyoti Ramteke,nan,Conference,International,IEEE
A Survey on Effects of Class Imbalance in Data Pre processing Stage of Classification Problem,2018-19,Student,UG,COMPS,B.E.,Dr. Anant V. Nimkar,nan,Journal,International,IEEE
A Survey on Machine Learning Techniques for Insurance Fraud Prediction,2018-19,Student,UG,COMPS,B.E.,Prof. Anand Godbole,nan,Conference,International,IEEE
"A Survey on Virtual Assistant: Google Assistant, Siri, Cortana, Alexa",2018-19,Student,UG,COMPS,B.E.,Dr. Sudhir Namdeorao Dhage,nan,Conference,International,IEEE
A Survey on Word Embedding Techniques and Semantic Similarity for Paraphrase Identification,2018-19,Student,UG,COMPS,B.E.,Dr. Anant V. Nimkar,nan,Journal,International,IEEE
A Systematic Approach to Customer Segmentation and Buyer Targeting for Profit Maximization,2018-19,Student,UG,COMPS,B.E.,Dr. Sudhir Namdeorao Dhage,nan,Conference,International,IEEE
A Two stage approach for Detection of Invasive and Cervical Intra-epithelial Neoplasia using MachineLearning and Image Processing Methodologies,2018-19,Student,UG,COMPS,B.E.,Prof. Pramod Bide,nan,Conference,International,IEEE
A Two stage approach for Detection of Invasive and Cervical Intra-epithelial Neoplasia using MachineLearning and Image Processing Methodologies,2018-19,Student,UG,COMPS,B.E.,Prof. Pramod Bide,nan,Conference,International,IEEE
Advanced credit score calculation using social media and machine learning,2018-19,Student,UG,COMPS,B.E.,Dr. Sudhir Namdeorao Dhage,nan,Journal,International,IEEE
Advanced Credit Scoring System Social Media and Machine Learning,2018-19,Student,PG,COMPS,F.Y.,Dr. Sudhir Namdeorao Dhage,nan,Conference,International,IEEE
Advancing Recommender Systems by mitigating Schilling Attacks,2018-19,Student,UG,COMPS,B.E.,Prof. Kiran Gawande,nan,Conference,International,IEEE
AI Use Cases in Operational Support System and Business Support System,2018-19,Student,UG,COMPS,B.E.,Dr. Deepak C Karia,nan,Conference,International,IEEE
Algorithm for using NLP with extremely small text datasets,2018-19,Student,UG,COMPS,B.E.,Prof. Reeta Koshy,nan,Conference,International,IEEE
An Atypical Approach for Uncovering the Essence of Emotions in Consumer Reviews,2018-19,Student,UG,COMPS,B.E.,Dr. Sudhir Namdeorao Dhage,nan,Conference,International,IEEE
Analysis of Programs for GPGPU Architectures,2018-19,Student,PhD,COMPS,PhD,Dr. Y.S. Rao,nan,Conference,International,IEEE
Automated Facial Regognition Attendance System Leveraging IoT Cameras,2018-19,Student,UG,COMPS,B.E.,Dr. Prachi Gharpure,nan,Conference,International,IEEE
Career Prediction Model Using Data Mining And Linear Classification,2018-19,Student,UG,COMPS,B.E.,Dr. Sudhir Namdeorao Dhage,nan,Conference,International,IEEE
Caucus: An Authentication Protocol for Cloud Federation,2018-19,Student,UG,COMPS,B.E.,Dr. Anant V. Nimkar,nan,Conference,International,IEEE
"Comparative Study of Breast Cancer Detection Techniques,",2018-19,Student,UG,COMPS,F.Y.,Dr. Sudhir Namdeorao Dhage,nan,Conference,International,IEEE
Comparative study of different methodologies to study Melanoma,2018-19,Student,UG,COMPS,B.E.,Dr. D. R. Kalbande,nan,Conference,International,IEEE
Comparative Study of KNN and ENN approaches for the Netflix Challenge,2018-19,Student,UG,COMPS,Faculty,Dr. D. R. Kalbande,nan,Conference,International,IEEE
Comparative Study of Trust and Reputation Security Models in IoT Networks,2018-19,Student,UG,COMPS,B.E.,Prof. Abhijeet Salunke,nan,Conference,International,IEEE
Context-aware hotel recommendation system based on hybrid approach to mitigate cold-start-problem,2018-19,Student,UG,COMPS,B.E.,Prof. Kiran Gawande,nan,Conference,International,IEEE
Cost Optimized Hybrid System in Digital Advertising Using Machine Learning,2018-19,Student,UG,COMPS,B.E.,Dr. D. R. Kalbande,Dr. Avinash Sharma,Journal,International,IEEE
Customer Attrition Estimation Modelling Basedon Predominant Attributes feed forward Network,2018-19,Student,UG,COMPS,B.E.,Prof. Kiran Gawande,nan,Conference,International,IEEE
Customer Churn Prediction Modeling based on Behavioural PAttern Analytics using Deep Learning,2018-19,Student,UG,COMPS,B.E.,Dr. Sudhir Namdeorao Dhage,nan,Conference,International,IEEE
Customer Churn Prediction Modelling Based on Behavioural Patterns using Artificial Neural Network & Analysis,2018-19,Student,UG,COMPS,B.E.,Dr. Sudhir Namdeorao Dhage,nan,Conference,International,IEEE
Design and Simulation of High SNR Varying Thickness Embedded Strain Sensing Polymer Microcantilever for BioSensing Applications,2018-19,Faculty,UG,COMPS,Faculty,nan,nan,Conference,International,IEEE
Design of SOI FinFET based Two Stage OperationalTransconductance Amplifier VLSI Circuits and Systems,2018-19,Student,UG,COMPS,F.Y.,Dr. Reena Sonkusare,Dr. Surendra S. Rathod,Conference,International,IEEE
Detecting Efficient Parking Space Using Smart Parking,2018-19,Student,UG,COMPS,B.E.,Prof. Surekha Dholay,nan,Conference,International,IEEE
Diabetes Disease Prediction using Machine Learning,2018-19,Student,PG,COMPS,F.Y.,Dr. Sudhir Namdeorao Dhage,nan,Conference,International,IEEE
Early stage detection of Psoriasis using Artificial Intelligence and Image Processing,2018-19,Student,UG,COMPS,B.E.,Dr. D. R. Kalbande,Dr. Avinash Sharma,Conference,International,IEEE
Easy Verdict: Digital Assistant to Resolve Criminal Litigation,2018-19,Student,UG,COMPS,B.E.,Prof. Reeta Koshy,nan,Conference,International,IEEE
Emergency Situation Responder: An efficient accident response app,2018-19,Student,UG,COMPS,F.Y.,Dr. Radha Shankarmani,nan,Conference,International,IEEE
Experimental Technique and Precautions for Measurement of Standing Wave Patterns inside the Rectangular Waveguide,2018-19,Student,UG,COMPS,F.Y.,Dr. Amol S Deshpande,nan,Conference,International,IEEE
Feature based Evaluation of Hotel Reviews and Rating for Differently able people,2018-19,Student,UG,COMPS,B.E.,Prof. Kiran Gawande,nan,Conference,International,IEEE
Fire Detection and Gas Leakage Prevention System,2018-19,Student,UG,COMPS,F.Y.,Dr. Deepak C Karia,nan,Conference,National,IEEE
Fire Detection and Gas Leakage Prevention System,2018-19,Student,UG,COMPS,F.Y.,Dr. Deepak C Karia,nan,Conference,National,IEEE
Gastrointestinal Tract Anomaly Detection from Endoscopy videos using Object Detection Approach,2018-19,Student,UG,COMPS,B.E.,Dr. D. R. Kalbande,nan,Conference,International,Springer
Gauging Customer Interest Using Skeletal Tracking and Convolutional Neural Network,2018-19,Student,UG,COMPS,B.E.,Dr. D. R. Kalbande,nan,Conference,International,IEEE
Genetic Algorithm for Optimal Feature Vector Selection in Facial Recognition,2018-19,Student,UG,COMPS,B.E.,Dr. Y.S. Rao,Prof. Kiran Talele,Conference,International,IEEE
Identification of Rumors on Twitter,2018-19,Student,UG,COMPS,B.E.,Prof. Kiran Gawande,Dr. Sudhir Namdeorao Dhage,Conference,International,IEEE
Issues in IoT Healthcare Platforms: A Critical Study and Review,2018-19,Student,UG,COMPS,B.E.,Dr. D. R. Kalbande,nan,Conference,International,IEEE
Keystroke Dynamics Authentication Using Small Datasets,2018-19,Student,UG,COMPS,B.E.,Dr. D. R. Kalbande,nan,Conference,International,IEEE
Krisha: An Interactive Mobile Application for Autism Children,2018-19,Student,UG,COMPS,B.E.,Prof. Nataasha Raul,nan,Conference,International,Springer
Machine Learning Approach for Diagnosis of Autism Spectrum Disorders,2018-19,Student,UG,COMPS,B.E.,Dr. D. R. Kalbande,nan,Conference,International,IEEE
MATE (Metro Assisstance To Elderly) App,2018-19,Student,UG,COMPS,F.Y.,Dr. D. R. Kalbande,nan,Journal,International,IEEE
Methodologies for Epilepsy Detection: Survey and Review,2018-19,Student,UG,COMPS,B.E.,Dr. D. R. Kalbande,nan,Conference,International,IEEE
News Popularity Prediction with Ensemble Methods of Classification,2018-19,Student,UG,COMPS,B.E.,Dr. Anant V. Nimkar,Yogesh Jadhav,Conference,International,IEEE
Optimization of External Stimulus Features for Hybrid Visual Brain Computer Interface,2018-19,Student,UG,COMPS,B.E.,Dr. D. R. Kalbande,nan,Conference,International,IEEE
Optimization of Schizophrenia Diagnosis Prediction using Machine Learning Techniques,2018-19,Student,UG,COMPS,B.E.,Dr. D. R. Kalbande,nan,Conference,International,IEEE
Performance Evaluation of an Adaptive MIMO-OFDM System Model for Wireless Networks,2018-19,Student,UG,COMPS,F.Y.,Dr. Preetida Vinayakray Jani,nan,Journal,International,IEEE
Portfolio Management using Artificial Intelligence,2018-19,Student,UG,COMPS,B.E.,Prof. Jyoti Ramteke,nan,Conference,International,Springer
Proportionate Study of Neuron Models for Implementation of Neural Encoder,2018-19,Student,UG,COMPS,F.Y.,Prof. Manisha Bansode,Dr. Surendra S. Rathod,Conference,International,IEEE
Real Estate Value Prediction Using Machine Learning,2018-19,Student,PG,COMPS,F.Y.,Dr. Sudhir Namdeorao Dhage,nan,Conference,National,IEEE
Review on Analysis Techniques for road Pothole Detection,2018-19,Faculty,UG,COMPS,B.E.,Dr. D. R. Kalbande,nan,Conference,International,IEEE
Sarcasm Detection on Twitter: User Behavior Approach,2018-19,Student,UG,COMPS,B.E.,Dr. Sudhir Namdeorao Dhage,nan,Conference,International,IEEE
SCM Enterprise solution using Soft Computing Techniques,2018-19,Faculty,UG,COMPS,Faculty,Dr. D. R. Kalbande,Dr. Avinash Sharma,Conference,International,Other
Security of 6LoWPAN IoT Networks in Hospitals for Medical Data Exchange,2018-19,Student,UG,COMPS,PhD,Dr. D. R. Kalbande,Dr. Avinash Sharma,Conference,International,IEEE
Sentiment Analysis of of quantify Healthcare data,2018-19,Student,UG,COMPS,B.E.,Prof. Sunil B. Ghane,nan,Conference,International,IEEE
SMENN : A Hybrid Approach for Noise Reduction in Imbalance Class Distribution,2018-19,Student,UG,COMPS,B.E.,Dr. Anant V. Nimkar,nan,Conference,International,IEEE
soft computing approach for measuring business process agility in an agile environment,2018-19,Student,UG,COMPS,B.E.,Prof. P. V. Kasambe,Dr. Surendra S. Rathod,Conference,International,IEEE
Survey on predicting property price,2018-19,Student,UG,COMPS,B.E.,Prof. Kiran Gawande,nan,Conference,International,IEEE
"Survey on Virtual Assistant: Google Assistant, Siri, Cortana and Alexa",2018-19,Student,PG,COMPS,F.Y.,Dr. Sudhir Namdeorao Dhage,nan,Conference,International,IEEE
Systematic Erudition of Bitcoin Price Prediction using Machine Learning Techniques,2018-19,Student,UG,COMPS,B.E.,Dr. Sudhir Namdeorao Dhage,nan,Conference,International,IEEE
Transfer Learning Model for detecting early stage of Prurigo Nodularis,2018-19,Student,UG,COMPS,B.E.,Dr. D. R. Kalbande,nan,Conference,International,IEEE
TweetNews: Location and Time-based News,2018-19,Student,UG,COMPS,B.E.,Dr. D. R. Kalbande,Prof. Sunil B. Ghane,Conference,International,IEEE
Wearable Internet of Things: Perspectives and Technology Challenges,2018-19,Student,UG,COMPS,F.Y.,Prof. Manish M. Parmar,nan,Conference,International,IEEE
Weight Assignment Algorithms for Designing Fully Connected Neural Network,2018-19,Faculty,PhD,COMPS,Faculty,Dr. D. R. Kalbande,nan,Journal,International,Other
A Survey of Predictive Crime Mapping Techniques for Smart Cities,2019-20,Student,UG,COMPS,B.E.,Dr. Anant V. Nimkar,nan,Conference,National,IEEE
A Two stage approach for Detection of Invasive and Cervical Intra-epithelial Neoplasia using Machine Learning and Image Processing Methodologies,2019-20,Student,PG,COMPS,B.E.,Prof. Pramod Bide,nan,Conference,National,IEEE
Agility of SCM Solution using Neural - Fuzzy approach,2019-20,Faculty,PhD,COMPS,Faculty,Dr. D. R. Kalbande,nan,Conference,International,Springer
Analytics and Visualization of Trends in News Articles,2019-20,Student,UG,COMPS,B.E.,Prof. Pramod Bide,nan,Conference,International,IEEE
Comparative Analysis of Over-The-Top Platforms : Amazon Prime Video and Netflix,2019-20,Student,UG,COMPS,B.E.,Prof. Pramod Bide,nan,Conference,International,Springer
Context Intelligent Crypto-Switching Algorithm for Document Security in Cloud Environment,2019-20,Student,UG,COMPS,B.E.,Prof. Dayanand Ambawade,nan,Conference,International,IEEE
Creation Of Face For Aiding In Forensic Investigation Based On Textual Description,2019-20,Student,UG,COMPS,B.E.,Prof. Varsha Hole,nan,Conference,International,IEEE
Crop Recommendation and its Optimal Pricing using ShopBot,2019-20,Student,UG,COMPS,T.Y.,Prof. Surekha Dholay,nan,Conference,International,IEEE
Determining User Behaviour Using System Calls To Prevent Internal Intrusions,2019-20,Student,UG,COMPS,B.E.,Prof. Jyoti Ramteke,nan,Conference,National,IEEE
Diet and Health Advisory Mechanism from Facial features using Machine Learning,2019-20,Student,UG,COMPS,B.E.,Dr. Anant V. Nimkar,nan,Conference,International,IEEE
Dual Sentiment Classification with Sarcasm Identification,2019-20,Student,PG,COMPS,F.Y.,Prof. Jyoti Ramteke,nan,Conference,International,IEEE
Elliptical curve cryptography based access control solution for IoT based WSN,2019-20,Student,PhD,COMPS,PhD,Dr. D. R. Kalbande,nan,Conference,International,Springer
Emotion and Depression Detection from Speech,2019-20,Student,UG,COMPS,B.E.,Dr. D. R. Kalbande,nan,Conference,International,Springer
Garbage Collection System Using IoT for Smart City,2019-20,Student,UG,COMPS,T.Y.,Dr. D. R. Kalbande,nan,Conference,International,IEEE
Image Enhancement in Security Systems using Machine Learning,2019-20,Student,PG,COMPS,B.E.,Dr. D. R. Kalbande,nan,Conference,International,Springer
Modelling Machine Learning For Analysing Crime News,2019-20,Student,UG,COMPS,B.E.,Dr. D. R. Kalbande,Prof. Nida Bakereywala,Conference,International,IEEE
Multi-user Adaptive Launcher for Android,2019-20,Student,PG,COMPS,B.E.,Prof. Nataasha Raul,nan,Conference,National,IEEE
Natural Language Parser for Physician's Handwritten Prescription,2019-20,Student,UG,COMPS,B.E.,Dr. Anant V. Nimkar,nan,Conference,International,IEEE
Portfolio Management using artificial intelligence,2019-20,Student,PG,COMPS,B.E.,Prof. Jyoti Ramteke,nan,Conference,National,Springer
Predictive Crime Mapping for Smart City,2019-20,Student,UG,COMPS,B.E.,Dr. Anant V. Nimkar,nan,Conference,International,Springer
QORAl: Q Learning based Delivery Optimization for Pharmacies,2019-20,Student,UG,COMPS,B.E.,Dr. Anant V. Nimkar,nan,Conference,International,IEEE
Sarcasm Detection Approaches Survey,2019-20,Student,PG,COMPS,B.E.,Dr. Sudhir Namdeorao Dhage,nan,Conference,National,Springer
Sarcasm Detection Approaches Survey,2019-20,Student,PG,COMPS,B.E.,Dr. Sudhir Namdeorao Dhage,nan,Conference,National,Springer
Smart Notifications based on Total Relevancy Score,2019-20,Student,UG,COMPS,B.E.,Prof. Pramod Bide,nan,Conference,International,Springer
Survey of Automated Waste Segregation Methods,2019-20,Student,PG,COMPS,B.E.,Dr. Sudhir Namdeorao Dhage,nan,Conference,National,Springer
Survey of Sentiment Analysis of Political Content on Twitter,2019-20,Student,UG,COMPS,B.E.,Prof. Pramod Bide,nan,Conference,International,Springer
Survey of Vacancy Detection Techniques in Parking Lots,2019-20,Student,UG,COMPS,B.E.,Prof. Surekha Dholay,nan,Conference,International,IEEE
