Title of Paper,Year,Application Type,Application Course,Application Department,Application Class,Guid 1 Name,Guid 2 Name,Type of Paper,Type of Publication,Conference_Type
Tool For Review Analysis Of Product,2019-20,Student,UG,COMPS,B.E.,Prof. Anand Godbole,nan,Conference,International,IEEE
Vehicle Number Plate Detection using Concolutional Neural Networks,2019-20,Student,UG,COMPS,F.Y.,Dr. Reena Sonkusare,nan,Conference,International,IEEE
Visual Question Answering Using Video Clips,2019-20,Student,PG,COMPS,B.E.,Dr. Anant V. Nimkar,nan,Conference,National,IEEE
Wireless lot based Solution for Women Safety in Rural Areas,2019-20,Student,PG,COMPS,B.E.,Dr. Prachi Gharpure,nan,Conference,National,IEEE
Activity Recognition and Fall Detection in Elderly People,2020-21,Student,UG,COMPS,B.E.,Dr. D. R. Kalbande,nan,Conference,International,IEEE
Alert Generation on Detection of Suspicious Activity Using Transfer Learning,2020-21,Student,UG,COMPS,B.E.,Dr. D. R. Kalbande,nan,Conference,International,IEEE
Detection of Flood Prone Areas by Flood Mapping of SAR Imagery,2020-21,Student,UG,COMPS,B.E.,Prof. Surekha Dholay,nan,Conference,International,IEEE
Micro Loans for Farmers,2020-21,Student,UG,COMPS,B.E.,Dr. D. R. Kalbande,nan,Conference,International,IEEE
Minimization of Food Waste in Retail Sector using Time-Series Analysis and Object Detection Algorithm,2020-21,Student,UG,COMPS,B.E.,Dr. D. R. Kalbande,nan,Conference,International,IEEE
Police Complaint Management System using Blockchain Technology,2020-21,Student,UG,COMPS,B.E.,Prof. Nataasha Raul,nan,Conference,International,IEEE
SEGRO: Key Towards Modern Waste Management,2020-21,Student,UG,COMPS,T.Y.,Prof. Pramod Bide,nan,Conference,International,IEEE
Virtual Reality: A Possible Technology to Subdue Disorder and Disability,2016-17,Faculty,UG,IT,Faculty,Prof. Jignesh Sisodia,nan,Conference,International,IEEE
"Advising Projects to Students using Data Mining and Natural Language Processing"",Volume 7, Issue 5 of IJARCSSE",2016-17,Faculty,UG,IT,Faculty,Prof. Swapnali Kurhade,nan,Conference,International,IEEE
An improved Round Robin CPU Scheduling Algorithm,2016-17,Student,UG,IT,B.E.,Prof. Sheetal Chaudhari,nan,Conference,International,IEEE
Cloud-based secure smartcard healthcare monitoring and tracking system,2016-17,Student,UG,IT,B.E.,Prof. Kailas Devadkar,nan,Conference,International,IEEE
Detection of VM-to-VM Attack using Hypervisor Statistics,2016-17,Student,UG,IT,M.E.,Prof. Kailas Devadkar,nan,Journal,International,IEEE
Dynamic load balancing strategy in Software Defined Networking,2016-17,Student,UG,IT,B.E.,Prof. Sheetal Chaudhari,nan,Conference,International,IEEE
Simulation of a two head disk Scheduling Algorithm,2016-17,Student,UG,IT,B.E.,Prof. Sheetal Chaudhari,nan,Conference,International,IEEE
Dynamic load balancing strategy in Software Defined Networking,2016-17,Student,UG,IT,B.E.,Prof. Sheetal Chaudhari,nan,Conference,International,IEEE
An improved Round Robin CPU Scheduling Algorithm,2016-17,Faculty,UG,IT,Faculty,Prof. Sheetal Chaudhari,nan,Conference,International,IEEE
"Knowledge Discovery,Analysis And Prediction in healthcare using Data Mining And Analytics",2016-17,Student,UG,IT,B.E.,Prof. Rupali Sawant,nan,Conference,International,IEEE
Multivariate correlation analysis for network intrusion detection,2016-17,Faculty,UG,IT,Faculty,Prof. Renuka Pawar,nan,Journal,International,IEEE
"Rajiv Sukhwani, Priyam Shah, Malhar Thombare",2016-17,Faculty,UG,IT,Faculty,Prof. Kailas Devadkar,nan,Conference,International,IEEE
Scheduling of Task in Collaborative Environment using MobileCloud,2016-17,Student,UG,IT,B.E.,Prof. Kailas Devadkar,nan,Conference,International,IEEE
Simulation of a two head disk Scheduling Algorithm,2016-17,Student,UG,IT,B.E.,Dr. D. R. Kalbande,nan,Conference,International,IEEE
Topology Control in the Presence of Jammers for Wireless Sensor Networks,2016-17,Faculty,UG,IT,Faculty,nan,nan,Journal,International,IEEE
Virtual Reality: A Possible Technology to Subdue Disorder and Disability,2016-17,Student,UG,IT,Student,Prof. Jignesh Sisodia,nan,Conference,International,IEEE
Efficient Data Searching and Retrieval Using Block Level Deduplication,2017-18,Student,UG,IT,B.E.,Prof. Kailas Devadkar,nan,Conference,International,IEEE
Simplified Recruitment Model Using Text-Mining on Psychometric And Aptitude Tests,2017-18,Student,UG,IT,B.E.,Prof. Aparna Halbe,nan,Conference,International,IEEE
A Distributed API for Live VM Migration in Cloudlets,2017-18,Student,UG,IT,B.E.,Dr. Prasenjit Bhavathankar,nan,Journal,International,IEEE
A Comparative Survey on Big Data Deduplication Techniques for Efficient Storage System,2017-18,Student,UG,IT,B.E.,Prof. Kailas Devadkar,nan,Conference,International,IEEE
Computation of spread of tweets on twitter,2017-18,Student,UG,IT,F.Y.,Dr. Radha Shankarmani,nan,Conference,International,IEEE
Darwin: Convolutional Neural Network based Intelligent Health Assistant,2017-18,Student,UG,IT,B.E.,Dr. Radha Shankarmani,nan,Conference,International,IEEE
G-PY: A Game Playing AI To Simulate Real Time Close-Quarter Firefights Using 3D First-Person-Shooter Games,2017-18,Student,UG,IT,B.E.,Prof. Jignesh Sisodia,nan,Conference,International,IEEE
Link-Quality Aware Path Selection in the Presence of Proactive Jamming in Fallible Wireless Sensor Networks,2017-18,Faculty,UG,IT,Faculty,nan,nan,Conference,International,IEEE
Optimal Decision Rule-Based Ex-ante Frequency Hopping for Jamming Avoidance in Wireless Sensor Networks,2017-18,Faculty,UG,IT,Faculty,nan,nan,Journal,International,IEEE
A Comparative Survey on Big Data Deduplication Techniques for Efficient Storage System,2017-18,Student,UG,IT,B.E.,Prof. Kailas Devadkar,nan,Conference,International,IEEE
A Comprehensive Integration of National Identity with Blockchain Technology,2017-18,Student,UG,IT,B.E.,Dr. Prasenjit Bhavathankar,nan,Conference,International,IEEE
A Distributed API for Live VM Migration in Cloudlets,2017-18,Student,UG,IT,B.E.,Dr. Prasenjit Bhavathankar,nan,Journal,International,IEEE
A Hybrid Model for Book Recommendation,2017-18,Student,UG,IT,B.E.,Prof. Swapnali Kurhade,nan,Conference,International,IEEE
A Machine learning based Medical Data analytics and visualization Research Platform,2017-18,Student,UG,IT,B.E.,Prof. Rupali Sawant,nan,Conference,International,IEEE
A steganographic approach to mitigate password attacks,2017-18,Student,UG,IT,B.E.,Prof. Renuka Pawar,nan,Conference,International,IEEE
A Survey on Blockchain Technology and its Impact on Business,2017-18,Student,UG,IT,B.E.,Dr. Radha Shankarmani,nan,Conference,International,IEEE
A Voice Controlled Smart Home Solution With a Centralized Management Framework Implemented Using AI and NLP,2017-18,Student,UG,IT,B.E.,Dr. Radha Shankarmani,nan,Conference,International,IEEE
Advising Projects to Students using Data Mining and Natural Language Processing,2017-18,Faculty,UG,IT,Faculty,Prof. Swapnali Kurhade,nan,Journal,International,IEEE
An Overview of VM Live Migration Strategies and Technologies,2017-18,Student,UG,IT,B.E.,Dr. Prasenjit Bhavathankar,nan,Conference,International,IEEE
Assessing employability of students using data mining techniques,2017-18,Student,UG,IT,B.E.,Dr. Radha Shankarmani,nan,Conference,International,IEEE
Blockchain Technology for Decentralized Data Storage on P2P Network” Springer,2017-18,Student,UG,IT,B.E.,Prof. Kailas Devadkar,nan,Conference,International,IEEE
Computation of spread of tweets on twitter,2017-18,Student,UG,IT,F.Y.,Dr. Radha Shankarmani,nan,Conference,International,IEEE
Customer Care Bot,2017-18,Student,UG,IT,B.E.,Dr. Radha Shankarmani,nan,Conference,International,IEEE
"Customer Care Bot”, in “International Conference on Energy",2017-18,Student,UG,IT,B.E.,Dr. Radha Shankarmani,nan,Conference,International,IEEE
Darwin: Convolutional Neural Network based Intelligent Health Assistant,2017-18,Student,UG,IT,B.E.,Dr. Radha Shankarmani,nan,Conference,International,IEEE
DHCP Protocol using OTP Based Two-Factor Authentication”,2017-18,Student,UG,IT,B.E.,Prof. Renuka Pawar,nan,Conference,International,IEEE
Diagnosis of Skin Diseases using Convolutional Neural Networks,2017-18,Student,UG,IT,B.E.,Dr. Prasenjit Bhavathankar,nan,Conference,International,IEEE
Disk Scheduling Sinewave Algorithm For Minimizing The Average Jump Rate Of A Hard Drive Over Its Lifetime,2017-18,Student,UG,IT,B.E.,Prof. Kailas Devadkar,nan,Conference,International,IEEE
Effect of High Performance Computing and Pooled Mining on Bitcoin,2017-18,Student,UG,IT,B.E.,Prof. Kailas Devadkar,nan,Conference,International,IEEE
Efficient Data Searching and Retrieval Using Block Level Deduplication,2017-18,Student,UG,IT,B.E.,Prof. Kailas Devadkar,nan,Conference,International,IEEE
Event based Query Offloading in Mobile Cloud Computing,2017-18,Student,UG,IT,B.E.,Prof. Kailas Devadkar,nan,Conference,International,IEEE
Generic User friendly chat bot model,2017-18,Faculty,PG,IT,Faculty,Dr. Pooja Raundale,nan,Conference,International,IEEE
Geographical Area Mapping and Classification Utilizing Multispectral Satellite Imagery Processing Based On Machine Learning Algorithms,2017-18,Student,UG,IT,B.E.,Prof. Aparna Halbe,nan,Conference,International,IEEE
Globe trotter: An Optimiztion Travel Sequence Generator,2017-18,Student,UG,IT,B.E.,Prof. Varsha Hole,nan,Conference,International,IEEE
G-PY: A Game Playing AI To Simulate Real Time Close-Quarter Firefights Using 3D First-Person-Shooter Games,2017-18,Student,UG,IT,B.E.,Prof. Jignesh Sisodia,nan,Conference,International,IEEE
"Interactive Augmented Reality-based System for Traditional Educational Media using Marker-derived Contextual Overlays""",2017-18,Student,UG,IT,B.E.,Prof. Renuka Pawar,nan,Conference,International,IEEE
Link-Quality Aware Path Selection in the Presence of Proactive Jamming in Fallible Wireless Sensor Networks,2017-18,Faculty,UG,IT,Faculty,Dr. Prasenjit Bhavathankar,nan,Conference,International,IEEE
Mapping Urban Ecosystem Services Using Synthetic-Aperture Radar (SAR) Images from Satellite Data for Rural Microgrids in India,2017-18,Student,UG,IT,B.E.,Prof. Jignesh Sisodia,nan,Conference,International,IEEE
Mapping Urban Ecosystem Services Using Synthetic-Aperture Radar (SAR) Images from Satellite Data for Rural Microgrids in India,2017-18,Student,UG,IT,B.E.,Prof. Jignesh Sisodia,nan,Conference,International,IEEE
Optimal Decision Rule-Based Ex-ante Frequency Hopping for Jamming Avoidance in Wireless Sensor Networks,2017-18,Faculty,UG,IT,Faculty,nan,nan,Journal,International,IEEE
Performance Analysis And Threshold PredictionAlgorithm for Efficient use of Cloud Computing,2017-18,Student,UG,IT,B.E.,Prof. Kailas Devadkar,nan,Conference,International,IEEE
Prediction of heart disease using machine learning,2017-18,Student,UG,IT,B.E.,Prof. Kailas Devadkar,nan,Conference,International,IEEE
Processing Retinal Images to Discover Diseases,2017-18,Student,UG,IT,B.E.,Prof. Kailas Devadkar,nan,Conference,International,IEEE
Restaurant’s Feedback Analysis System using Sentimental Analysis and Data Mining Techniques,2017-18,Student,UG,IT,B.E.,Prof. Rupali Sawant,nan,Conference,International,IEEE
Secure Complaint bot using Onion Routing Algorithm,2017-18,Student,UG,IT,B.E.,Prof. Renuka Pawar,nan,Conference,International,IEEE
Secure gateway defender- a network intrusion detection system,2017-18,Student,UG,IT,B.E.,Prof. Renuka Pawar,nan,Conference,International,IEEE
Simplified Recruitment Model Using Text-Mining on Psychometric And Aptitude Tests,2017-18,Student,UG,IT,B.E.,Prof. Aparna Halbe,nan,Conference,International,IEEE
Vitamins and Minerals Diagnosis System Using Neural Network,2017-18,Student,UG,IT,B.E.,Prof. Varsha Hole,nan,Conference,International,IEEE
WLAN Attendance Management System,2017-18,Student,UG,IT,B.E.,Prof. Kailas Devadkar,nan,Conference,International,IEEE
Predicting Depression from Social media posts using Machine Learning Approach,2018-19,Student,UG,IT,B.E.,Prof. Kailas Devadkar,nan,Conference,International,IEEE
Predicting Surface Air temperature using Convolutional Long Short term memory networks,2018-19,Student,UG,IT,B.E.,Prof. Kailas Devadkar,nan,Conference,International,IEEE
Storage and Availability Aware Fragment Placement for P2P storage systems,2018-19,Student,UG,IT,B.E.,Prof. Kailas Devadkar,nan,Conference,International,IEEE
A comprehensive review of keystroke dynamics based authentication mechanism,2018-19,Faculty,UG,IT,Faculty,Dr. Radha Shankarmani,nan,Conference,International,IEEE
A Hybrid model for Book recommendation,2018-19,Student,UG,IT,B.E.,Prof. Swapnali Kurhade,nan,Conference,International,IEEE
A Novel Approach for Data Visualization by supporting ad-hoc query and Predictive analysis,2018-19,Student,UG,IT,B.E.,Prof. Aparna Halbe,nan,Conference,International,IEEE
A review on Development and Classification of Question-Answering Systems,2018-19,Student,UG,IT,B.E.,Prof. Nikahat Mulla,nan,Conference,International,IEEE
A Review On Recent Approaches to Recommendation System Model Using Distinct Product Features,2018-19,Faculty,UG,IT,Faculty,nan,nan,Conference,International,IEEE
A Smart Toll Collection System based on Vehicle Classification,2018-19,Student,UG,IT,B.E.,Dr. Prasenjit Bhavathankar,nan,Conference,International,IEEE
A study of factors leading to stress in indian college students,2018-19,Student,UG,IT,B.E.,Prof. Swapnali Kurhade,nan,Conference,International,IEEE
An Approach for Predication of Complications Women fights during Maternal period,2018-19,Faculty,UG,IT,Faculty,nan,nan,Journal,International,IEEE
An overview of VM Live migration strategies and Technologies,2018-19,Student,UG,IT,B.E.,Dr. Prasenjit Bhavathankar,nan,Conference,International,IEEE
Comparison of execution time of mobile application using equal division and profile based algorithm in mobile cloud computing,2018-19,Faculty,UG,IT,Faculty,Dr. D. R. Kalbande,nan,Conference,International,IEEE
DHCP protocol using OTP based two factor authentication,2018-19,Student,UG,IT,B.E.,Prof. Renuka Pawar,nan,Conference,International,IEEE
Diagnosis of skin diseases using Convolutional Neural Networks,2018-19,Student,UG,IT,B.E.,Dr. Prasenjit Bhavathankar,nan,Conference,National,IEEE
Filtering and Analysis of Big Data to Improve Performance,2018-19,Student,UG,IT,B.E.,Dr. Radha Shankarmani,nan,Conference,International,IEEE
G-PY : A Game playing AI to simulate real time close quarter firefights using 3D first person shooter games,2018-19,Student,UG,IT,B.E.,Prof. Jignesh Sisodia,nan,Conference,International,IEEE
Indoor Object Tracking using Wi-Fi Access Points,2018-19,Student,UG,IT,B.E.,Dr. Prasenjit Bhavathankar,nan,Conference,International,IEEE
Interactive Augmented Reality based system for Traditional educational media using Marker derived contextual overlays,2018-19,Student,UG,IT,B.E.,Prof. Renuka Pawar,nan,Conference,International,IEEE
Peer Assisted Parallel Downloading System,2018-19,Student,UG,IT,B.E.,Prof. Kailas Devadkar,nan,Conference,International,IEEE
Predicting Depression from Social media posts using Machine Learning Approach,2018-19,Student,UG,IT,B.E.,Prof. Kailas Devadkar,nan,Conference,International,IEEE
Predicting Surface Air temperature using Convolutional Long Short term memory networks,2018-19,Student,UG,IT,B.E.,Prof. Kailas Devadkar,nan,Conference,International,IEEE
Prediction of Heart Disease Using Machine Learning,2018-19,Student,UG,IT,B.E.,Prof. Kailas Devadkar,nan,Conference,National,IEEE
Real Time Scene Descriptor-Android Applicatio,2018-19,Student,UG,IT,B.E.,Prof. Varsha Hole,nan,Conference,International,IEEE
Real-Time Environment Description Application for Visually Challenged People,2018-19,Student,UG,IT,B.E.,Prof. Varsha Hole,nan,Conference,International,IEEE
Restaurant's Feedback Analysis System using Sentimentsl Analysis and Data Mining Techniques,2018-19,Student,UG,IT,B.E.,Prof. Rupali Sawant,nan,Conference,National,IEEE
Securing patients information in IOT environment,2018-19,Faculty,UG,IT,B.E.,Prof. Renuka Pawar,nan,Conference,International,IEEE
Storage and Availability Aware Fragment Placement for P2P storage systems,2018-19,Student,UG,IT,B.E.,Prof. Kailas Devadkar,nan,Conference,International,IEEE
Storage and Availabity Fragement Placement for P2P storage System,2018-19,Student,UG,IT,B.E.,Prof. Kailas Devadkar,nan,Conference,International,IEEE
Vitamins and MInerals Diagnosis using neural network,2018-19,Student,UG,IT,B.E.,Prof. Varsha Hole,nan,Conference,International,IEEE
A Cost-Efficient and Time Saving Exercise Posture Monitoring System,2019-20,Student,UG,IT,B.E.,Prof. Jignesh Sisodia,nan,Conference,International,Springer
A Hybrid Solution To Abstractive Multi-Document Summarization Using Supervised and Unsupervised Learning,2019-20,Student,UG,IT,B.E.,Prof. Nikahat Mulla,nan,Conference,International,IEEE
A Next Generation Refrigerator on Compartmentalization Concept with Consumption Based Ordering,2019-20,Student,UG,IT,B.E.,Prof. Kailas Devadkar,nan,Conference,International,IEEE
A Self Learning Chat-Bot From User Interactions and Preferences,2019-20,Student,UG,IT,T.Y.,Dr. Radha Shankarmani,nan,Conference,International,IEEE
A Self-Driving Car Implementation using Computer Vision for Detection and Navigation,2019-20,Student,UG,IT,B.E.,Prof. Jignesh Sisodia,nan,Conference,International,IEEE
A Smart Toll Collection System based on Vehicle Classification,2019-20,Student,UG,IT,B.E.,Dr. Prasenjit Bhavathankar,nan,Conference,National,IEEE
A Survey: Mobile Cloud Computing in Education,2019-20,Student,UG,IT,B.E.,Prof. Kailas Devadkar,nan,Conference,International,IEEE
Abstractive Text Summarization on Google Search Results,2019-20,Student,UG,IT,T.Y.,Prof. Varsha Hole,nan,Conference,International,IEEE
Attention Based Encoding and Decoding of Convolutional Neural Networks,2019-20,Student,UG,IT,B.E.,Prof. Nikahat Mulla,nan,Conference,International,IEEE
Augment It Yourself,2019-20,Student,UG,IT,B.E.,Prof. Renuka Pawar,nan,Journal,International,IEEE
Automation of Cheque Transaction using Deep Learning and Optical Character Recognition,2019-20,Student,UG,IT,B.E.,Prof. Rupali Sawant,nan,Conference,International,IEEE
Autonomous Flying using Deep Reinforcement Learning,2019-20,Student,UG,IT,B.E.,Prof. Nikahat Mulla,nan,Conference,International,Springer
Blockchain Based Direct Benefit Transfer System For Subsidy Delivery,2019-20,Student,UG,IT,B.E.,Dr. Prasenjit Bhavathankar,nan,Conference,International,IEEE
Blockchain: A new way to revolutionize CRM systems,2019-20,Student,UG,IT,B.E.,Prof. Kailas Devadkar,nan,Conference,National,IEEE
Cellular Device Detection in Restricted Premises,2019-20,Student,UG,IT,B.E.,Dr. Prasenjit Bhavathankar,nan,Conference,International,IEEE
Decentralized system for Fundraising using Ethereum,2019-20,Student,UG,IT,B.E.,Prof. Aparna Halbe,nan,Conference,International,IEEE
DETECTING A TWITTER CYBERBULLYING USING MACHINE LEARNING,2019-20,Student,UG,IT,T.Y.,Prof. Aparna Halbe,nan,Conference,International,IEEE
Digital Forensics : Maintaining Chain of Custody using Blockchain,2019-20,Student,UG,IT,B.E.,Prof. Renuka Pawar,nan,Conference,International,IEEE
Early Detection of Hemiplegia by Analyzing the Gait Characteristics and Walking Patterns Using Convolutional Neural Networks,2019-20,Student,UG,IT,B.E.,Prof. Jignesh Sisodia,nan,Conference,International,IEEE
Food suggestion engine based on Mood - FoMos,2019-20,Student,UG,IT,B.E.,Prof. Kailas Devadkar,nan,Conference,International,IEEE
Impact of Twitter Data and News Articles on Stock Market,2019-20,Student,UG,IT,B.E.,Prof. Varsha Hole,nan,Conference,National,IEEE
Machine Learning: An aid in detection of Neurodegenerative disease Parkinson,2019-20,Student,PhD,IT,Faculty,Dr. D. R. Kalbande,nan,Conference,International,Springer
Novel Approach to Solve Rubik’s Cube Using Advanced Fridrich CFOP Algorithm,2019-20,Student,UG,IT,T.Y.,Prof. Aparna Halbe,nan,Conference,International,IEEE
Optimal Allocation and Scheduling of Buses,2019-20,Student,UG,IT,T.Y.,Prof. Aparna Halbe,nan,Conference,International,IEEE
Potential Customer classification in Customer Relationship Management using Fuzzy Logic,2019-20,Student,UG,IT,B.E.,Prof. Kailas Devadkar,nan,Conference,International,IEEE
Rash Driving Analysis for Safety Enforcement,2019-20,Student,UG,IT,B.E.,Prof. Kailas Devadkar,nan,Conference,International,IEEE
Real Time Object Detection for Visually Challenged Persons,2019-20,Student,UG,IT,T.Y.,Dr. Radha Shankarmani,nan,Conference,International,IEEE
Self Employment Opportunities Search Using Web Crawling,2019-20,Student,UG,IT,F.Y.,Dr. Radha Shankarmani,nan,Conference,International,IEEE
Study Of Mse Edge And Ssim Of Canny Detection,2019-20,Student,UG,IT,B.E.,Prof. Aparna Halbe,nan,Journal,International,Other
Tailor-GAN Optmization using Log cosine hyperbloic fucntion,2019-20,Student,UG,IT,T.Y.,Prof. Varsha Hole,nan,Conference,International,Springer
The Universal Research Portal,2019-20,Student,UG,IT,B.E.,Dr. Radha Shankarmani,nan,Conference,International,IEEE
Unsupervised WhatsApp Fake News Detection using Semantic Search,2019-20,Student,UG,IT,T.Y.,Prof. Aparna Halbe,nan,Conference,International,IEEE
User Profiling Based Recommendation System for E-Learning,2019-20,Student,UG,IT,B.E.,Dr. Radha Shankarmani,nan,Conference,International,IEEE
Video Steganography: Storing data in the transition of frames,2019-20,Student,UG,IT,T.Y.,Prof. Varsha Hole,nan,Conference,International,Springer
A HYBRID RECOMMENDATION SYSTEM FOR RESTAURANTS,2020-21,Student,UG,IT,B.E.,Dr. D. R. Kalbande,nan,Conference,International,IEEE
A Proficient Process for Systematic Inventory Management,2020-21,Student,UG,IT,B.E.,Dr. Prasenjit Bhavathankar,nan,Conference,International,IEEE
A Virtual Trial Room Using Pose Estimation and Homography,2020-21,Student,UG,IT,B.E.,Dr. Radha Shankarmani,nan,Conference,International,IEEE
AI based Conversational Bot to Assist Users in Planning and Achieving Academic Goals,2020-21,Student,UG,IT,B.E.,Dr. D. R. Kalbande,nan,Journal,International,Other
An Efficient Method to Provide Investment Avenues to Retail Investors,2020-21,Student,UG,IT,B.E.,Dr. Prasenjit Bhavathankar,nan,Conference,International,IEEE
Application of Feature Selection and Random Forest Classifier on a Medical Dataset,2020-21,Student,UG,IT,B.E.,Dr. Radha Shankarmani,nan,Journal,International,Other
Automated Lip Reading using Word Level Sentence Prediction based on LSTMs and Attention,2020-21,Student,UG,IT,B.E.,Dr. Radha Shankarmani,nan,Journal,International,Other
Blockchain-based e-Tendering System,2020-21,Student,UG,IT,B.E.,Dr. Radha Shankarmani,nan,Conference,International,IEEE
Categorizing Driving Patterns Based on Telematics Data Using Supervised And Unsupervised Learning,2020-21,Student,UG,IT,B.E.,Prof. Renuka Pawar,nan,Conference,International,IEEE
Emergency Situation Responder: An efficient accident response app,2020-21,Student,UG,IT,B.E.,Dr. Radha Shankarmani,nan,Conference,International,IEEE
Machine Learning Approach for Analysis of The Company Performance based on Fundamental Data,2020-21,Student,UG,IT,B.E.,Prof. Jignesh Sisodia,nan,Conference,International,Springer
Natural Language processing based Abstractive Text Summarization of Reviews,2020-21,Student,UG,IT,B.E.,Prof. Varsha Hole,nan,Conference,International,IEEE
Skill Based Course Recommendation System,2020-21,Student,UG,IT,B.E.,Dr. Radha Shankarmani,nan,Conference,International,IEEE
User Engagement Recognition using Transfer Learning and Multitask Classification,2020-21,Student,UG,IT,T.Y.,Prof. Varsha Hole,nan,Conference,International,Springer
Virtual Assistant For The Visually Imapired,2020-21,Student,UG,IT,B.E.,Prof. Kailas Devadkar,nan,Conference,International,IEEE
A compact monopole antenna for wireless applications with enhanced bandwidth,2016-17,Student,PG,ETRX,Faculty,Dr. Deepak C Karia,nan,Journal,International,IEEE
A Compact Two Via Slot-Type Electromagnetic Bandgap Structure,2016-17,Student,UG,ETRX,B.E.,Dr. Surendra S. Rathod,Dr. K.T.V. Reddy,Journal,International,IEEE
A Comprehensive Architecture for Correlation Analysis to Improve the Performance of Security Operation Center,2016-17,Faculty,PhD,ETRX,Faculty,nan,nan,Conference,International,IEEE
An algorithm for detection of ECG morphological points using its non-linear energy,2016-17,Student,PG,ETRX,Faculty,Dr. Rajendra Sutar,nan,Journal,International,IEEE
An Empirical Intelligent Agent for Robot Navigation Problem Using Supervised Learning,2016-17,Student,UG,ETRX,F.Y.,Prof. G. T. Haldankar,nan,Conference,International,IEEE
Certificate Pinning for Android Applications,2016-17,Student,UG,ETRX,B.E.,Dr. Deepak C Karia,nan,Conference,International,IEEE
Current Mode Based Communication System,2016-17,Faculty,PhD,ETRX,Faculty,nan,nan,Journal,International,Other
Design of Apollonian Gasket Bow Tie Antenna for Satellite Application,2016-17,Student,UG,ETRX,B.E.,Dr. Deepak C Karia,nan,Conference,International,IEEE
Design of low voltage supply Current Feedback Operational Amplifier,2016-17,Student,PG,ETRX,F.Y.,nan,nan,Conference,International,IEEE
Design of SOI FinFET based Two Stage Operational Transconductance Amplifier,2016-17,Student,PG,ETRX,F.Y.,nan,nan,Journal,International,IEEE
Edge Preserving and Smoothing and Enhancement for Electronic Portal Images,2016-17,Student,PG,ETRX,M.E.,Prof. Kiran Talele,nan,Conference,International,IEEE
Facial Expression Recognition Using General Regression Neural NetworkIEEE Bombay Section Symposium at VPKBIET,2016-17,Student,PG,ETRX,S.Y.MTech,Dr. Kushal Tuckley,nan,Conference,International,IEEE
Feature extraction and selection methods for motor imagery EEG signals: A review,2016-17,Student,PG,ETRX,F.Y.,Dr. Payal Hitesh Shah,nan,Conference,International,IEEE
Hard Decoding Based Design of Regular LDPC using Labview,2016-17,Student,PG,ETRX,F.Y.,Dr. Deepak C Karia,nan,Conference,International,IEEE
