Title of Paper,Year,Application Type,Application Course,Application Department,Application Class,Guid 1 Name,Guid 2 Name,Type of Paper,Type of Publication,Conference_Type
Human Action Unit Detection of Patient using Geometric Feature Analysis,2016-17,Faculty,PG,ETRX,Faculty,,nan,Conference,National,IEEE
Human Body Language Understanding for Action Detection using Geometric Features,2016-17,Student,PG,ETRX,S.Y.MTech,Prof. Kiran Talele,nan,Conference,International,IEEE
MMC: Multiple Metric Cost Routing Metric for Wireless Mesh Networks,2016-17,Student,UG,ETRX,B.E.,Dr. Deepak C Karia,nan,Conference,International,IEEE
Multiband Circular Bow Tie Antenna Design using Apollonian Gasket of Fractals,2016-17,Student,PG,ETRX,F.Y.,Dr. Deepak C Karia,nan,Conference,International,IEEE
Synapse circuits Implementation and Analysis in 180nm MOSFET and CNTFET technology,2016-17,Student,UG,ETRX,F.Y.,Dr. D. R. Kalbande,nan,Conference,International,IEEE
Tunable microstrip antenna using reactive impedance surface,2016-17,Student,PG,ETRX,F.Y.,Dr. Deepak C Karia,nan,Conference,International,IEEE
A Hybrid Approach for MRI based Statistical Feature Extraction to Detect Brain Tumor,2017-18,Student,UG,ETRX,F.Y.,Dr. Payal Hitesh Shah,Dr. Rajendra Sutar,Journal,International,IEEE
A Novel Fault Monitoring Mechanism for Overhead Transmission Line,2017-18,Student,UG,ETRX,F.Y.,Prof. Narendra Bhagat,nan,Conference,International,IEEE
A Schematic Review on Body Area Networks for E-Health Systems,2017-18,Student,UG,ETRX,F.Y.,Dr. Rajendra Sutar,nan,Conference,International,IEEE
Agriculture Monitoring System,2017-18,Student,UG,ETRX,F.Y.,Dr. D. R. Kalbande,nan,Conference,International,IEEE
C-Indicator: A Mobile App for Crowd Control and Management in Suburban Railways using IP,2017-18,Student,UG,ETRX,F.Y.,Dr. D. R. Kalbande,nan,Conference,International,IEEE
Computation and Analysis of Excitatory Synapse and Integrate & Fire Neuron: 180nm MOSFET and CNFET Technology,2017-18,Student,UG,ETRX,F.Y.,Dr. Surendra S. Rathod,nan,Journal,International,IEEE
Current Mode Full Wave Rectifier Topology forIntegration,2017-18,Student,UG,ETRX,F.Y.,Prof. Narendra Bhagat,Dr. Uday Pandit Khot,Conference,International,IEEE
Design and Development of Farm Automation System using NI myRIO,2017-18,Student,UG,ETRX,F.Y.,Dr. Deepak C Karia,nan,Conference,International,IEEE
Design of a Battery-less Solar Energy Storage system based on Re-generation of Energy,2017-18,Student,UG,ETRX,F.Y.,Prof. G. T. Haldankar,nan,Conference,International,IEEE
Design of low voltage supply Current Feedback Operational Amplifier,2017-18,Student,UG,ETRX,F.Y.,Prof. Narendra Bhagat,Dr. Uday Pandit Khot,Conference,International,IEEE
Design of SOI FinFET based Two Stage Operational Transconductance Amplifier,2017-18,Student,UG,ETRX,F.Y.,Dr. Reena Sonkusare,Dr. Surendra S. Rathod,Journal,International,IEEE
Development of LabVIEW Platform for EEG Signal Analysis,2017-18,Student,UG,ETRX,F.Y.,Prof. P. V. Kasambe,Dr. Surendra S. Rathod,Conference,International,IEEE
Efficient and Feasible Gesture Controlled Robotic Arm,2017-18,Student,UG,ETRX,F.Y.,Dr. Payal Hitesh Shah,nan,Conference,International,IEEE
FIS based Autonomous Navigation System,2017-18,Student,UG,ETRX,F.Y.,Prof. G. T. Haldankar,Prof. P. V. Kasambe,Conference,International,IEEE
High gain ultra wide band MIMO antenna,2017-18,Student,UG,ETRX,F.Y.,Dr. Deepak C Karia,nan,Conference,International,IEEE
HYDROBOT: An Underwater SurveillanceSwimming Robot,2017-18,Student,UG,ETRX,F.Y.,Prof. Priya Chimurkar,nan,Conference,International,IEEE
Implementation of MRI Gradient Generation System and Controller on Field Programmable Gate Array(FPGA),2017-18,Student,UG,ETRX,F.Y.,Dr. Surendra S. Rathod,nan,Conference,International,IEEE
Implementation of PLC based Automated PCB Fabrication System,2017-18,Student,UG,ETRX,F.Y.,Prof. P. V. Kasambe,Dr. Surendra S. Rathod,Conference,International,IEEE
Intelligent Chatting Service Using AIML,2017-18,Student,UG,ETRX,F.Y.,Prof. Najib Ghatte,nan,Conference,International,IEEE
LabVIEW based EMG and blood pressure measurement bio telemetry system,2017-18,Student,UG,ETRX,F.Y.,Dr. Deepak C Karia,nan,Conference,International,IEEE
LabVIEW Based Real Time Bio-Telemetry System for Healthcare,2017-18,Student,UG,ETRX,F.Y.,Dr. Deepak C Karia,nan,Conference,International,IEEE
Low Profile UHF RFID Tag Antenna,2017-18,Student,UG,ETRX,F.Y.,Prof. Manisha Bansode,nan,Journal,International,IEEE
Mutual Coupling Reduction in Patch Antenna Using Electromagnetic Band Gap (EBG) Structure for IoT Application,2017-18,Student,UG,ETRX,PhD,Dr. Surendra S. Rathod,Dr. K.T.V. Reddy,Conference,International,IEEE
Piezoelectric Lead Zirconate Titanate (PZT) Ring Shaped Contour-Mode MEMS Resonators,2017-18,Student,UG,ETRX,F.Y.,Dr. Surendra S. Rathod,D. V. Bhoir,Journal,International,IEEE
Simulation and Analysis of analog VLSI Silicon Neuron using Carbon Nanotube Field Effect Transistor and 180nm MOSFET Technology,2017-18,Student,UG,ETRX,F.Y.,Dr. Surendra S. Rathod,nan,Journal,International,IEEE
SMART-Smart Mobile Autonomous Robotic Trolley,2017-18,Student,UG,ETRX,B.E.,Prof. Narendra Bhagat,Prof. Priya Chimurkar,Conference,International,IEEE
A Low-Cost Implementation of an IoT based Food Ordering System,2018-19,Student,UG,ETRX,B.E.,Prof. Priya Deshpande,nan,Journal,International,IEEE
Augmented Reality based Education App,2018-19,Student,UG,ETRX,B.E.,Prof. G. T. Haldankar,nan,Conference,International,IEEE
Comparative Study of Roger and FR-4 Based Circularly Polarized Microstrip Patch Antenna with Injecting a Single Set of Shorting Pins,2018-19,Student,UG,ETRX,B.E.,Dr. Deepak C Karia,nan,Conference,International,IEEE
Driver Assistant System using Haar Cascade and Convolution Neural Networks (CNN),2018-19,Student,UG,ETRX,B.E.,Dr. Payal Hitesh Shah,Prof. Kiran Talele,Conference,International,IEEE
Fast and Accurate Algorithm for Line Following Robot,2018-19,Student,UG,ETRX,B.E.,Dr. Rajendra Sutar,nan,Conference,International,IEEE
Prediction of sudden Cardiact Death using classification and Regression tree model using Coalesced based ECG and Clanical Data,2018-19,Student,UG,ETRX,B.E.,Dr. Deepak C Karia,nan,Conference,International,IEEE
Voltage-Mode and Current-Mode FSK Demodulator using IC AD844 at Circuit Level,2018-19,Faculty,UG,ETRX,B.E.,Dr. Uday Pandit Khot,nan,Conference,International,Other
Agribot-An intelligent interactive interface to assist farmers in agricultural activities,2019-20,Student,UG,ETRX,B.E.,Dr. D. R. Kalbande,nan,Conference,International,IEEE
An FPGA Based Hardware Emulator for Neuromorphic Chip,2019-20,Student,PG,ETRX,S.Y.,Dr. Surendra S. Rathod,Dr. Payal Hitesh Shah,Conference,International,IEEE
Instrumentation of Data Acquisition for EIT,2019-20,Student,UG,ETRX,B.E.,Prof. Priya Deshpande,nan,Journal,International,Other
Manhole detection using image processing on Google Street View imagery,2019-20,Student,UG,ETRX,B.E.,Dr. D. R. Kalbande,nan,Conference,International,IEEE
Real Time Plant Watering System,2019-20,Student,UG,ETRX,B.E.,Dr. Surendra S. Rathod,nan,Journal,International,Other
RELIABLE MACHINE TO MACHINE COMMUNICATION USING MQTT PROTOCOL AND MEAN STACK,2019-20,Student,UG,ETRX,B.E.,Dr. Deepak C Karia,nan,Conference,International,Springer
Remote Structural health Monitoring,2019-20,Student,UG,ETRX,B.E.,Prof. Manisha Bansode,Dr. Deepak C Karia,Conference,International,IEEE
Smart Medicine Distributing Tray,2019-20,Student,UG,ETRX,B.E.,Dr. Deepak C Karia,nan,Conference,International,Springer
AI Powered Holistic Solution for Travelers during Pandemic,2020-21,Student,UG,ETRX,B.E.,Dr. D. R. Kalbande,nan,Journal,International,IEEE
AI Powered Holistic Solution for Travelersduring Pandemic,2020-21,Student,UG,ETRX,B.E.,Dr. D. R. Kalbande,nan,Journal,International,IEEE
Real-TIme Batter Monitoring System for Solar Infrastructure,2020-21,Faculty,UG,ETRX,Faculty,nan,nan,Conference,International,IEEE
Reducing Overfitting in Diabetic Retinopathy Detection using Transfer Learning,2020-21,Student,UG,ETRX,B.E.,Dr. Rajendra Sutar,Dr. Deepak C Karia,Conference,International,IEEE
Speed Breaker Detection and Mapping using IoT,2020-21,Student,UG,ETRX,B.E.,Prof. Priya Deshpande,nan,Conference,International,IEEE
Agile parameters affecting supply chain management strategy,2016-17,Faculty,PG,MCA,Faculty,Dr. D. R. Kalbande,nan,Journal,International,IEEE
Customer Product Experience Analysis using Text Mining : A Neuro Linguistic Programming Approach,2016-17,Faculty,PG,MCA,Faculty,nan,nan,Conference,National,IEEE
Efficient Heart Disease Prediction system using Optimization Technique,2016-17,Student,PG,MCA,T.Y.MCA,Prof. Sakina Salmani,nan,Conference,International,IEEE
Expert System for Early Detection of the foot ulcer in Peripheral Neuropathy using ThermographyInternational Journal of Multidisciplinary Research Review(IJMDRR),2016-17,Faculty,PG,MCA,Faculty,Dr. Pooja Raundale,nan,Conference,International,Other
IoT based biomedical waste classification quantification and managementRole of SMAC Technologies in Diabetes Management using ITS,2016-17,Faculty,PG,MCA,Faculty,Dr. Pooja Raundale,nan,Conference,International,IEEE
Personalized Intelligent Tutoring System using Reinforcement Learning for an Autistic Student to teach Skating,2016-17,Faculty,PG,MCA,Faculty,Dr. Pooja Raundale,nan,Journal,International,IEEE
Selection of Enterprise Architecture based on agile parameters for SCM based case study,2016-17,Faculty,PG,MCA,Faculty,Dr. D. R. Kalbande,nan,Journal,International,IEEE
soft computing approach for measuring business process agility in an agile environment,2016-17,Faculty,PG,MCA,Faculty,Dr. D. R. Kalbande,nan,Conference,International,Other
Solving enterprise solution complexity in SCM domain through business process agility,2016-17,Faculty,PG,MCA,Faculty,Dr. D. R. Kalbande,nan,Conference,International,IEEE
Big Data analytics in agriculture and distribution channel,2017-18,Faculty,PG,MCA,Faculty,Dr. Pooja Raundale,nan,Conference,International,IEEE
Blockchain Technology: Most Secure Database,2017-18,Student,PG,MCA,T.Y.MCA,Prof. Harshil Kanakia,nan,Conference,International,IEEE
Blockchain Technology: Most Secure Database,2017-18,Student,PG,MCA,T.Y.MCA,Prof. Harshil Kanakia,nan,Conference,International,IEEE
"Classification based data mining algorithms to predict slow, average and fast learners in educational system using Weka",2017-18,Faculty,PG,MCA,Faculty,Dr. Pooja Raundale,nan,Conference,International,IEEE
Detecting man in the middle attack,2017-18,Student,PG,MCA,S.Y.MCA,Prof. Nikhita Mangaonkar,nan,Journal,International,IEEE
Loyalty Prediction system for e-commerce using Natural language Processing and Neuro Linguistic Approach,2017-18,Faculty,PG,MCA,Faculty,nan,nan,Conference,International,IEEE
SCM Enterprise solution using Soft Computing Techniques,2017-18,Faculty,PG,MCA,Faculty,Dr. D. R. Kalbande,nan,Conference,International,IEEE
weight assignment algorithm for designing fully connected neural network,2017-18,Faculty,PG,MCA,Faculty,Dr. D. R. Kalbande,nan,Journal,International,IEEE
Agility of SCM Solution using Neural - Fuzzy approach,2018-19,Faculty,PG,MCA,Faculty,Dr. D. R. Kalbande,nan,Conference,International,IEEE
An analytical study of evaluation indicators of smart cities,2018-19,Faculty,PG,MCA,Faculty,nan,nan,Conference,International,IEEE
Analysis of Recommendation Model For e-commerce Websites Based on Rating Dataset,2018-19,Student,PG,MCA,T.Y.MCA,Prof. Harshil Kanakia,nan,Conference,International,IEEE
Analysis of Social Networks using Naive Bayes,2018-19,Student,PG,MCA,T.Y.MCA,Prof. Harshil Kanakia,nan,Conference,International,IEEE
Anticipating pointless ER visits to lessen human services costs,2018-19,Student,PG,MCA,T.Y.MCA,Prof. Pallavi Thakur,nan,Conference,National,IEEE
Bilateral Selection Sort,2018-19,Student,PG,MCA,T.Y.MCA,Prof. Rupesh Bhoir,nan,Journal,International,IEEE
Business process analyzed factors affecting business model innovation,2018-19,Faculty,PhD,MCA,Faculty,Dr. D. R. Kalbande,nan,Conference,International,IEEE
CAMBRIDGE ANALYTICA - A CASE STUDY,2018-19,Student,PG,MCA,T.Y.MCA,Prof. Harshil Kanakia,nan,Conference,International,IEEE
Comparitive study of Data Compression Techniques,2018-19,Student,PG,MCA,S.Y.MCA,Dr. Pooja Raundale,nan,Journal,International,IEEE
Credit card Fraud detection,2018-19,Student,PG,MCA,S.Y.MCA,nan,nan,Conference,International,IEEE
Crime Spot Detection for Chain Snatching Using Data Mining,2018-19,Student,PG,MCA,T.Y.MCA,Dr. Pooja Raundale,nan,Conference,International,IEEE
Sentiment analysis of mobile product reviews,2018-19,Student,PG,MCA,T.Y.MCA,Prof. Rupesh Bhoir,nan,Journal,International,IEEE
Smart solutions for Smart city,2018-19,Faculty,PG,MCA,Faculty,nan,nan,Conference,International,IEEE
Abstractive vs Extractive Text Summarization (Output based approach) - A Comparative Study,2019-20,Student,PG,MCA,T.Y.MCA,Prof. Nikhita Mangaonkar,nan,Conference,International,IEEE
ANALYSIS OF GROUP DECISION-MAKING WITH OSCAR RESULTS PREDICTION USING TWITTER API,2019-20,Student,PG,MCA,T.Y.MCA,Prof. Pallavi Thakur,nan,Conference,National,Other
Analysis of Recommendation Model For E-commerce Websites Based on Rating Dataset,2019-20,Student,PG,MCA,T.Y.MCA,Prof. Harshil Kanakia,nan,Conference,National,IEEE
Analysis of Social Networks using Naive Bayes,2019-20,Student,PG,MCA,T.Y.MCA,Prof. Harshil Kanakia,Dr. Pooja Raundale,Conference,National,IEEE
Analysis on Text Summarization,2019-20,Student,PG,MCA,T.Y.MCA,Dr. Neeti Desai,nan,Journal,National,Other
Analytical and Comparative Study of Face Detection and Face Recognition Techniques for Visually Impaired and Blind People,2019-20,Student,PG,MCA,T.Y.MCA,Prof. Taruna Sharma,nan,Journal,National,IEEE
Cambridge Analytica - A Case Study,2019-20,Student,UG,MCA,T.Y.MCA,Prof. Harshil Kanakia,nan,Conference,National,Other
Cambridge Analytica - A Case Study,2019-20,Student,UG,MCA,T.Y.MCA,Prof. Harshil Kanakia,nan,Conference,National,Other
Companies with dominance in their sector: A Preliminary Study,2019-20,Student,PG,MCA,S.Y.MCA,Prof. Sakina Salmani,nan,Journal,National,Other
Comparative Study of Data Compression Techniques,2019-20,Student,PG,MCA,S.Y.MCA,Dr. Pooja Raundale,nan,Journal,National,Other
Containerzation and its efficiency on google cloud platform,2019-20,Student,PG,MCA,S.Y.MCA,Prof. Nikhita Mangaonkar,nan,Conference,National,Other
Crime spot Detection for chain Snatching using Data Mining,2019-20,Student,PG,MCA,S.Y.MCA,Prof. Sakina Salmani,Prof. Mayura Nagar,Conference,National,Other
Deepfake: A Survey on Facial Forgery Technique Using Generative Adversarial Network,2019-20,Student,PG,MCA,S.Y.MCA,Prof. Sakina Salmani,nan,Conference,National,IEEE
Detection of Motor Deficits in Children with Autism Spectrum Disorder using FTT,2019-20,Student,PG,MCA,S.Y.MCA,Dr. Pooja Raundale,nan,Conference,International,IEEE
Emotion Identification using CNN based Transfer Learning,2019-20,Faculty,PG,MCA,Faculty,Dr. D. R. Kalbande,nan,Conference,International,Springer
IOT Smart Locker,2019-20,Student,PG,MCA,S.Y.MCA,Dr. Aarti Karande,nan,Conference,International,Springer
MATE- Metro Assistance To Elderly App,2019-20,Student,PG,MCA,T.Y.MCA,Prof. Pallavi Thakur,nan,Journal,International,IEEE
MINI,2019-20,Student,PG,MCA,T.Y.MCA,Prof. Taruna Sharma,nan,Journal,National,Other
Robotic Process Automation,2019-20,Student,PG,MCA,T.Y.MCA,Prof. Pallavi Thakur,nan,Journal,International,IEEE
Sentiment Analysis of college Reviews using Machine Learning & Data Mining,2019-20,Student,PG,MCA,T.Y.MCA,Prof. Mayura Nagar,Prof. Pallavi Thakur,Journal,National,Other
Smart Parking Systems,2019-20,Student,PG,MCA,T.Y.MCA,Dr. Pooja Raundale,nan,Journal,National,Other
Smart Twitter Analysis on Location using Kali Linux,2019-20,Student,PG,MCA,T.Y.MCA,Prof. Sakina Salmani,nan,Journal,International,Springer
Bilateral Selection Sort.,2020-21,Student,PG,MCA,T.Y.MCA,Prof. Rupesh Bhoir,nan,Conference,International,IEEE
A Sparsity-Independent Greedy Compressive Sensing algorithm for Cognitive Radio,2016-17,Student,UG,EXTC,F.Y.,Dr. Preetida Vinayakray Jani,nan,Conference,International,IEEE
A Sparsity-Independent Greedy Compressive Sensing algorithm for Cognitive Radio,2016-17,Student,UG,EXTC,F.Y.,Dr. Preetida Vinayakray Jani,nan,Conference,International,IEEE
A DTLS Based Lightweight Authentication Scheme using Symetric Keys for Internet of Things,2016-17,Student,UG,EXTC,F.Y.,Prof. Dayanand Ambawade,nan,Conference,International,IEEE
A Low Complexity Iterative SLM-OFDM for SHF band applications,2016-17,Faculty,PhD,EXTC,Faculty,Dr. B. K. Mishra,nan,Conference,International,IEEE
A Novel Structure of Photonic Crystal Fiber for Dispersion Compensation Over Broadband Range,2016-17,Student,PhD,EXTC,F.Y.,nan,nan,Conference,International,Other
A Side Channel based Power Analysis Technique for Hardware Trojan Detection using Statistical Learning Approach,2016-17,Student,UG,EXTC,F.Y.,Prof. Dayanand Ambawade,nan,Conference,International,IEEE
Analysis of High Current Sheet Beam Transportation,2016-17,Student,PhD,EXTC,Faculty,nan,nan,Conference,International,Other
Analysis of Multifin n-FinFET for Analog Performance at 30m,2016-17,Student,UG,EXTC,F.Y.,Dr. Surendra S. Rathod,nan,Conference,International,IEEE
Analysis of Multifin n-FinFET for Analog Performance at 30nm Gate Length,2016-17,Faculty,PhD,EXTC,Faculty,Dr. Surendra S. Rathod,nan,Conference,International,IEEE
Comparison of multiple attribute decision making algorithms in heterogeneous networks,2016-17,Student,UG,EXTC,F.Y.,Dr. Sukanya A. Kulkarni,nan,Conference,International,IEEE
Comprehensive Architecture For Correlation Analysis To Improve The Performance of Security Operation Center,2016-17,Student,UG,EXTC,F.Y.,Prof. Dayanand Ambawade,nan,Conference,International,IEEE
Design and Modal Analysis of Photonic Crystal Fiber for Dispersion Compensation over Broadband Range,2016-17,Student,PhD,EXTC,PhD,nan,nan,Conference,International,Other
Design of Ultra-Wideband (UWB) MIMO Antenna,2016-17,Student,UG,EXTC,F.Y.,Dr. Sukanya A. Kulkarni,nan,Conference,International,IEEE
Electromagnetic Wave Theory for Calculation of Exact Magnetic Field in Case of BWO,2016-17,Student,PhD,EXTC,PhD,nan,nan,Conference,International,Other
Enhancement of vertical handover in heterogeneous networks,2016-17,Student,UG,EXTC,F.Y.,Dr. Sukanya A. Kulkarni,nan,Conference,International,IEEE
Facial Expression Classification using Support Vector Machine Based on Bidirectional Local Binary Pattern Histogram Feature Descriptor,2016-17,Faculty,PhD,EXTC,Faculty,nan,nan,Conference,International,IEEE
Incorporated Moving Cast Shadows Recognition Technique For Observation Recordings,2016-17,Student,UG,EXTC,F.Y.,Prof. Vijaya Kamble,nan,Conference,International,IEEE
IoT based Smart Local Transport Tracking System,2016-17,Faculty,UG,EXTC,Faculty,nan,nan,Conference,International,IEEE
A Low Complexity Iterative SLM-OFDM for SHF band applications,2016-17,Student,PhD,EXTC,PhD,nan,nan,Conference,International,IEEE
On Orthogonal Phase Sequence Sets For MIMO SLM System,2016-17,Student,PhD,EXTC,PhD,Dr. Sukanya A. Kulkarni,nan,Conference,International,IEEE
Low Power Current-mode Frequency Shift Keying (FSK) Transmitter,2016-17,Faculty,PhD,EXTC,Faculty,nan,nan,Conference,International,IEEE
Modelling of Sleeve Monopole Antenna in a Coupling Medium for Breast Imaging Application,2016-17,Student,UG,EXTC,F.Y.,Prof. Anand D. Mane,nan,Conference,International,IEEE
OMP and KLT : A comparative performance analysis of compressive spectrum sensing in cognitive radio,2016-17,Student,UG,EXTC,F.Y.,Dr. Sukanya A. Kulkarni,nan,Journal,International,IEEE
On Orthogonal Phase Sequence Sets For MIMO SLM System,2016-17,Faculty,PhD,EXTC,Faculty,Dr. B. K. Mishra,nan,Conference,International,IEEE
PAPR Performance Analysis of Unitary transforms in SLM-OFDM for WLAN 802.11a Mobile terminals,2016-17,Student,UG,EXTC,F.Y.,Dr. Sukanya A. Kulkarni,nan,Conference,International,IEEE
Parametric Study Rectangular Patch Antennas,2016-17,Student,PG,EXTC,PhD,Dr. Surendra S. Rathod,Dr. K.T.V. Reddy,Journal,International,IEEE
Partitioning Android Mobile Application For Improving Execution Time,2016-17,Faculty,PhD,EXTC,Faculty,nan,nan,Conference,International,IEEE
Performance Analysis of Simple Rectangular Microstrip Patch Antenna and Gap Coupled Rectangular Microstrip Patch Antenna,2016-17,Student,UG,EXTC,F.Y.,Dr. Reena Sonkusare,nan,Conference,International,IEEE
Review on microwave generation using backward wave oscillator,2016-17,Student,PhD,EXTC,PhD,nan,nan,Conference,International,IEEE
Understanding the focusing of charged particle for 2D Sheet Beam in a Cusped Magnetic Field,2016-17,Student,PhD,EXTC,PhD,Prof. Arti Hadap,Dr. K.T.V. Reddy,Conference,International,IEEE
Object Detection and Localization Using Compressed Sensing,2017-18,Student,UG,EXTC,F.Y.,Dr. Preetida Vinayakray Jani,nan,Conference,International,IEEE
Efficient Energy Harvesting by using thermoelectric module,2017-18,Student,UG,EXTC,F.Y.,Prof. Vijaya Kamble,nan,Conference,International,IEEE
"Finger-Vein Template Protection using Compressed Sensing, in Lecture Notes in Network and Systems, Innovations in Computer Science and Engineering",2017-18,Student,UG,EXTC,F.Y.,Dr. Preetida Vinayakray Jani,nan,Conference,International,IEEE
A Compact Two Via Hammer Spanner Type Polarization Dependent Electromagnetic Band Gap Structure,2017-18,Student,UG,EXTC,PhD,Dr. Surendra S. Rathod,Dr. K.T.V. Reddy,Journal,International,IEEE
A Compact Two Via Slot-Type Electromagnetic Bandgap Structure,2017-18,Faculty,UG,EXTC,PhD,Dr. Surendra S. Rathod,Dr. K.T.V. Reddy,Journal,International,IEEE
A Comparative Study on Recent Image Steganography Techniques Based on DWT,2017-18,Student,UG,EXTC,F.Y.,Dr. Preetida Vinayakray Jani,nan,Conference,International,IEEE
A Low Complexity Iterative SLM-OFDM for SHF band applications,2017-18,Faculty,UG,EXTC,Faculty,Dr. B. K. Mishra,nan,Journal,International,IEEE
A Real-time Object Detecting System using Compressive Sensing.,2017-18,Student,UG,EXTC,F.Y.,Dr. Preetida Vinayakray Jani,nan,Conference,International,IEEE
A Survey on Security Attacks and Countermeasures in RPL for Internet of Things,2017-18,Student,UG,EXTC,F.Y.,Prof. Manish M. Parmar,nan,Conference,International,IEEE
Design of Reconfigurable Wideband MIMO Antenna,2017-18,Student,UG,EXTC,F.Y.,Dr. Sukanya A. Kulkarni,nan,Conference,International,IEEE
Dual Band Mimo Antenna With Enhanced Gain” paper at IEEE Indian Antenna Week,2017-18,Student,UG,EXTC,F.Y.,Prof. Anand D. Mane,nan,Conference,International,IEEE
Efficient Energy Harvesting by using thermoelectric module,2017-18,Student,UG,EXTC,F.Y.,Prof. Vijaya Kamble,nan,Conference,International,IEEE
Evaluation of Image Processing Techniques on a Single Chip Digital Signal Processor,2017-18,Student,UG,EXTC,F.Y.,Dr. Y.S. Rao,nan,Conference,International,IEEE
Evaluation of SDR using open source technology,2017-18,Student,UG,EXTC,F.Y.,Dr. Y.S. Rao,nan,Conference,International,IEEE
Finger-Vein Template Protection using Compressed Sensing,2017-18,Student,UG,EXTC,F.Y.,Dr. Preetida Vinayakray Jani,nan,Conference,International,IEEE
Internet of Things: Existing protocols and technological challenges in security,2017-18,Student,UG,EXTC,F.Y.,Prof. Dayanand Ambawade,nan,Conference,International,IEEE
Network Lifetime Enhancement using Improved Honey Bee Optimization based Routing Protocol for WSN,2017-18,Student,UG,EXTC,F.Y.,Dr. Sukanya A. Kulkarni,nan,Conference,International,IEEE
Object Detection and Localization Using Compressed Sensing,2017-18,Student,UG,EXTC,F.Y.,Dr. Preetida Vinayakray Jani,nan,Conference,International,IEEE
Opinion Metric Based Intrusion Detection Mechanism for RPL Protocol in IoT,2017-18,Student,UG,EXTC,F.Y.,Prof. Dayanand Ambawade,nan,Conference,International,IEEE
Performance analysis of Real time Object Tracking System based on Compressive Sensing,2017-18,Student,UG,EXTC,F.Y.,Dr. Preetida Vinayakray Jani,nan,Conference,International,IEEE
Performance analysis of Real time Object Tracking System based on Compressive Sensing,2017-18,Student,UG,EXTC,F.Y.,Dr. Preetida Vinayakray Jani,nan,Conference,International,IEEE
Performance Enhancement of Wireless Mobile Network using Cross-Layer Design,2017-18,Student,UG,EXTC,F.Y.,Prof. Anand D. Mane,nan,Conference,International,IEEE
Total Ionising Dose Effects on HFO2 and AL2O3 Gate Oxide SOI FinFET,2017-18,Student,UG,EXTC,F.Y.,Dr. Reena Sonkusare,Dr. Surendra S. Rathod,Journal,International,IEEE
Trust based mechanism for Securing IoT Routing Protocol RPL against Wormhole & Grayhole Attacks,2017-18,Student,UG,EXTC,F.Y.,Prof. Manish M. Parmar,nan,Conference,International,IEEE
A Compact Two Via Slot-Type Electromagnetic Bandgap Structure,2018-19,Student,PhD,EXTC,PhD,Dr. Surendra S. Rathod,nan,Conference,International,IEEE
A Compact Two-via Hammer Spanner-Type Polarization-Dependent Electromagnetic Bandgap Structure,2018-19,Student,PhD,EXTC,PhD,Dr. Surendra S. Rathod,nan,Conference,International,IEEE
Analysis of Subthreshold SOI FinFET based Two Stage OTA for Low Power,2018-19,Student,PhD,EXTC,F.Y.,Dr. Surendra S. Rathod,nan,Conference,International,IEEE
Design and Analysis of SOI FinFET based Three Stage OTA with Nested Gm-C Frequency Compensation,2018-19,Student,PhD,EXTC,F.Y.,Dr. Surendra S. Rathod,nan,Conference,International,IEEE
Phase’s Interval’s Granule Based Cache Behavioral Categorization of Benchmark Workloads,2018-19,Student,PhD,EXTC,PhD,nan,nan,Conference,International,IEEE
A 10-Bit 10-MS/s 5.72 nW Mixed SAR Logic for ADC used in Wireless Sensor Node,2018-19,Student,PhD,EXTC,PhD,nan,nan,Conference,International,IEEE
A Compact Dual Band Gap Electromagnetic Band Gap Structure,2018-19,Student,UG,EXTC,PhD,Dr. Reena Sonkusare,Dr. K.T.V. Reddy,Journal,International,IEEE
